<?xml version="1.0" encoding="UTF-8"?>
<xsd:schema elementFormDefault="qualified" xmlns:xsd="http://www.w3.org/2001/XMLSchema">
  <xsd:element name="MODNOTAFISCAL">
    <xsd:annotation>
      <xsd:documentation>Modelo de dados para integração</xsd:documentation>
    </xsd:annotation>
    <xsd:complexType>
      <xsd:sequence>
        <xsd:element name="NOTAFISCAL">
          <xsd:annotation>
            <xsd:documentation>Integração de nota fiscal</xsd:documentation>
          </xsd:annotation>
          <xsd:complexType>
            <xsd:all>
              <xsd:element name="ID" minOccurs="1" maxOccurs="1">
                <xsd:annotation>
                  <xsd:documentation> ID do registro </xsd:documentation>
                </xsd:annotation>
                <xsd:complexType>
                  <xsd:sequence>
                    <xsd:element name="value">
                      <xsd:simpleType>
                        <xsd:restriction base="xsd:string">
                          <xsd:minLength value="1"/>
                          <xsd:maxLength value="20"/>
                        </xsd:restriction>
                      </xsd:simpleType>
                    </xsd:element>
                  </xsd:sequence>
                </xsd:complexType>
              </xsd:element>
              <xsd:element name="NOTANUM" minOccurs="1" maxOccurs="1">
                <xsd:annotation>
                  <xsd:documentation> Número da NF </xsd:documentation>
                </xsd:annotation>
                <xsd:complexType>
                  <xsd:sequence>
                    <xsd:element name="value">
                      <xsd:simpleType>
                        <xsd:restriction base="xsd:int">
                        </xsd:restriction>
                      </xsd:simpleType>
                    </xsd:element>
                  </xsd:sequence>
                </xsd:complexType>
              </xsd:element>
              <xsd:element name="NFSERIE" minOccurs="1" maxOccurs="1">
                <xsd:annotation>
                  <xsd:documentation> Série da NF </xsd:documentation>
                </xsd:annotation>
                <xsd:complexType>
                  <xsd:sequence>
                    <xsd:element name="value">
                      <xsd:simpleType>
                        <xsd:restriction base="xsd:string">
                          <xsd:minLength value="1"/>
                          <xsd:maxLength value="5"/>
                        </xsd:restriction>
                      </xsd:simpleType>
                    </xsd:element>
                  </xsd:sequence>
                </xsd:complexType>
              </xsd:element>
              <xsd:element name="CODCLIENTE" minOccurs="1" maxOccurs="1">
                <xsd:annotation>
                  <xsd:documentation> Código do cliente da NF </xsd:documentation>
                </xsd:annotation>
                <xsd:complexType>
                  <xsd:sequence>
                    <xsd:element name="value">
                      <xsd:simpleType>
                        <xsd:restriction base="xsd:string">
                          <xsd:minLength value="1"/>
                          <xsd:maxLength value="15"/>
                        </xsd:restriction>
                      </xsd:simpleType>
                    </xsd:element>
                  </xsd:sequence>
                </xsd:complexType>
              </xsd:element>
              <xsd:element name="ENTREGA" minOccurs="1" maxOccurs="1">
                <xsd:annotation>
                  <xsd:documentation> Data de emissão da NF. Formato: AAAA-MM-DDTHH:MM:SSZ (Ex.: 2017-05-10T21:07:04Z) </xsd:documentation>
                </xsd:annotation>
                <xsd:complexType>
                  <xsd:sequence>
                    <xsd:element name="value">
                      <xsd:simpleType>
                        <xsd:restriction base="xsd:string">
                          <xsd:minLength value="1"/>
                          <xsd:maxLength value="40"/>
                        </xsd:restriction>
                      </xsd:simpleType>
                    </xsd:element>
                  </xsd:sequence>
                </xsd:complexType>
              </xsd:element>
              <xsd:element name="SAIDA" minOccurs="1" maxOccurs="1">
                <xsd:annotation>
                  <xsd:documentation> Data de saida da NF. Formato: AAAA-MM-DDTHH:MM:SSZ (Ex.: 2017-05-10T21:07:04Z) </xsd:documentation>
                </xsd:annotation>
                <xsd:complexType>
                  <xsd:sequence>
                    <xsd:element name="value">
                      <xsd:simpleType>
                        <xsd:restriction base="xsd:string">
                          <xsd:minLength value="1"/>
                          <xsd:maxLength value="40"/>
                        </xsd:restriction>
                      </xsd:simpleType>
                    </xsd:element>
                  </xsd:sequence>
                </xsd:complexType>
              </xsd:element>
              <xsd:element name="VALORTOTAL" minOccurs="1" maxOccurs="1">
                <xsd:annotation>
                  <xsd:documentation> Valor total da NF (soma dos itens) </xsd:documentation>
                </xsd:annotation>
                <xsd:complexType>
                  <xsd:sequence>
                    <xsd:element name="value" default="0">
                      <xsd:simpleType>
                        <xsd:restriction base="xsd:decimal">
                          <xsd:pattern value="0|0\.[0-9]{1,2}|[0-9]{0,12}(\.[0-9]{1,2})?" />
                        </xsd:restriction>
                      </xsd:simpleType>
                    </xsd:element>
                  </xsd:sequence>
                </xsd:complexType>
              </xsd:element>
              <xsd:element name="VALORNOTA" minOccurs="1" maxOccurs="1">
                <xsd:annotation>
                  <xsd:documentation> Valor final da NF </xsd:documentation>
                </xsd:annotation>
                <xsd:complexType>
                  <xsd:sequence>
                    <xsd:element name="value" default="0">
                      <xsd:simpleType>
                        <xsd:restriction base="xsd:decimal">
                          <xsd:pattern value="0|0\.[0-9]{1,2}|[0-9]{0,12}(\.[0-9]{1,2})?" />
                        </xsd:restriction>
                      </xsd:simpleType>
                    </xsd:element>
                  </xsd:sequence>
                </xsd:complexType>
              </xsd:element>
              <xsd:element name="STATUS" minOccurs="1" maxOccurs="1">
                <xsd:annotation>
                  <xsd:documentation> Status da NF: 1 = EMITIDA ou 2 = CANCELADA </xsd:documentation>
                </xsd:annotation>
                <xsd:complexType>
                  <xsd:sequence>
                    <xsd:element name="value">
                      <xsd:simpleType>
                        <xsd:restriction base="xsd:string">
                          <xsd:minLength value="1"/>
                          <xsd:maxLength value="1"/>
                        </xsd:restriction>
                      </xsd:simpleType>
                    </xsd:element>
                  </xsd:sequence>
                </xsd:complexType>
              </xsd:element>
              <xsd:element name="VENDAID" minOccurs="1" maxOccurs="1">
                <xsd:annotation>
                  <xsd:documentation> Número da venda da NF </xsd:documentation>
                </xsd:annotation>
                <xsd:complexType>
                  <xsd:sequence>
                    <xsd:element name="value">
                      <xsd:simpleType>
                        <xsd:restriction base="xsd:int">
                        </xsd:restriction>
                      </xsd:simpleType>
                    </xsd:element>
                  </xsd:sequence>
                </xsd:complexType>
              </xsd:element>
              <xsd:element name="OBS" minOccurs="0" maxOccurs="1">
                <xsd:annotation>
                  <xsd:documentation> Observação da NF </xsd:documentation>
                </xsd:annotation>
                <xsd:complexType>
                  <xsd:sequence>
                    <xsd:element name="value">
                      <xsd:simpleType>
                        <xsd:restriction base="xsd:string">
                          <xsd:minLength value="1"/>
                          <xsd:maxLength value="2000"/>
                        </xsd:restriction>
                      </xsd:simpleType>
                    </xsd:element>
                  </xsd:sequence>
                </xsd:complexType>
              </xsd:element>              
            </xsd:all>
            <xsd:attribute name="OPERACAOINTEGRACAO" use="optional">
              <xsd:annotation>
                <xsd:documentation>Tipo da Operação. Inclusão ou Edição: 0 ou Sem Atributo; Exclusão: 1</xsd:documentation>
              </xsd:annotation>
            </xsd:attribute>
          </xsd:complexType>
        </xsd:element>
      </xsd:sequence>
    </xsd:complexType>
  </xsd:element>  
</xsd:schema>
